{
  "runScopes": [
    {
      "name": "debug",
      "run": true
    },
    {
      "name": "VnV",
      "run": false
    },
    {
      "name": "performance",
      "run": false
    }
  ],
  "testLibraries": [
    "hello/there/libTest.so",
    "hello/there/libTest1.so"
  ],
  "outputEngine": {
    "outputFile": "hello",
    "debug": true,
    "configFile": "there",
    "type": "debug",
    "extra": {
      "hello": "there",
      "another": "one",
      "not": "required"
    }
  },
  "injectionPoints": [
    {
      "name": "injectionPoint1",
      "tests": [
        {
          "name": "EuclideanError",
          "stages": {
            "0": {
              "ipId": 0,
              "mapping": {
                "test1": {
                  "ipParameter": "x"
                },
                "test2": {
                  "ipParameter": "y",
                  "transform": "y2z"
                }
              }
            },
            "1": {
              "ipId": -1,
              "mapping": {
                "test3": {
                  "ipParameter": "x"
                },
                "test4": {
                  "ipParameter": "x"
                }
              }
            }
          },
          "runScope": [
            "performance"
          ]
        }
      ]
    }
  ]
}
